{
  "authorityMode": "PUBLIC_ED25519_NO_FALLBACK",
  "baseAuthority": {
    "canonicalContractFileSha256": "ede8e2a728c588cafc4f614e7858495f138cf7b208b7048166b66610fd5c6de1",
    "canonicalContractOutputSha256": "8588703a71b4f02411d876eaf4a276d1e0836706fab3428de2509b3849571def",
    "canonicalContractPath": "production/reports/biological-continuity-v3/g002-evidence-v1/canonical-root-redesign-targets-v1.json",
    "publicManifestFileSha256": "ea86e51a1fc21eaaad708e256bf3348480fa284d201814ec71f89fec128889af",
    "publicManifestOutputSha256": "5b29298aaf917955ac8f094552948ee4093be363a478e92d987fc5b13d88e01c",
    "publicManifestPath": "production/reports/biological-continuity-v3/g002-evidence-v1/public-evidence-manifest.json"
  },
  "files": [
    {
      "path": "production/reports/biological-continuity-v3/g002-evidence-v2/assignment-manifest.json",
      "sha256": "9b5d863fa77e6e124b16f64c3268e6badafab801a837d812b07650dd07a2fb0e"
    },
    {
      "path": "production/reports/biological-continuity-v3/g002-evidence-v2/canonical-root-redesign-targets-v2.json",
      "sha256": "01b1f63f570f82a304b5e661e14c4454e5b82895dca4e414cfb2b2a511a073f2"
    },
    {
      "path": "production/reports/biological-continuity-v3/g002-evidence-v2/canonical-root-reviews/architect-approval.json",
      "sha256": "791ab4cefc7e2982ad69c57cc907753d1d05c38a0fd369dc98b798f87c3f1dae"
    },
    {
      "path": "production/reports/biological-continuity-v3/g002-evidence-v2/canonical-root-reviews/proofs/PG-024.json",
      "sha256": "b97ea830849571943bdca13a3181b34f1f0cca9c4300c4a2a727955cf50b165f"
    },
    {
      "path": "production/reports/biological-continuity-v3/g002-evidence-v2/canonical-root-reviews/proofs/PG-029.json",
      "sha256": "0f28a21ea56444038c09f3bddcb2bff96c06634b225e8a371185fc1949d29613"
    },
    {
      "path": "production/reports/biological-continuity-v3/g002-evidence-v2/canonical-root-reviews/proofs/PG-047.json",
      "sha256": "1be8e1f30bff8d10b7e549e8f5c14a87a2dec232da8b974eb478cf433e134448"
    },
    {
      "path": "production/reports/biological-continuity-v3/g002-evidence-v2/canonical-root-reviews/proofs/PG-052.json",
      "sha256": "73a19ed4115aa96789d11aae91517d0e78cd84e011b69a2ae9835c4ba0b9a3e7"
    },
    {
      "path": "production/reports/biological-continuity-v3/g002-evidence-v2/canonical-root-reviews/proofs/PG-053.json",
      "sha256": "e46147c98ae1ae48c659add281f73bdb6adb60487f7a901e688492b483bd0f9c"
    },
    {
      "path": "production/reports/biological-continuity-v3/g002-evidence-v2/canonical-root-reviews/proofs/PG-056.json",
      "sha256": "277220a7fec7ba46600d3153710cf99c1a1e79260a55c91adb151027199366ae"
    },
    {
      "path": "production/reports/biological-continuity-v3/g002-evidence-v2/compatibility-ledger.json",
      "sha256": "f07cf112a7f38af7c7b4769fd8a69f756000f01011e96adc404ec2f1f7f4dee4"
    },
    {
      "path": "production/reports/biological-continuity-v3/g002-evidence-v2/feasibility-report.json",
      "sha256": "02b90a1a25aa67a23e0c01c22bc86492003fe904f153bed27aa5e9d2092adda3"
    },
    {
      "path": "production/reports/biological-continuity-v3/g002-evidence-v2/inputs.lock.json",
      "sha256": "65e2f26041f29556b8adeb5a8ffd8e8684ef972897edca8dffa87f4cce0822c7"
    },
    {
      "path": "production/reports/biological-continuity-v3/g002-evidence-v2/output-attestation.json",
      "sha256": "1bda20c881512214b6f508abdc8f79a5bf0739898437565449716fa9b9b3ea03"
    },
    {
      "path": "production/reports/biological-continuity-v3/g002-evidence-v2/regeneration-queue.json",
      "sha256": "aaa359abad8744f120298110d96c80ca6095405510a8fa9aa73d6838c9fba922"
    },
    {
      "path": "production/reports/biological-continuity-v3/g002-evidence-v2/save-revision-map.json",
      "sha256": "cfa85535e9fb7eac7b7556812c235d38905c57efe308ffe03256e800be155c99"
    },
    {
      "path": "production/reports/biological-continuity-v3/g002-evidence-v2/topology-after.json",
      "sha256": "f95c5c9e9998d7fd7c9d38bb41802f513c8a73c78baf612666ca916ddbe109e9"
    }
  ],
  "outputSha256": "3fee012ba96fbd22ba5921185495bb5d6cbc622bba7b7a2769c56050af2cf430",
  "publicSignature": {
    "algorithm": "Ed25519",
    "authorityFingerprint": "423f474c59667e5eabc13a703b8d7de4e97bcba33cdc22340873866db9d6a53f",
    "signatureBase64": "wSacMJdzBugKFK98wsFZvVa7f4sJRogdB0SszJdqer9SXakXJeCSalZnazEtGng5X47KpG4WtbnYO3kugQg5DA=="
  },
  "runId": "g002-v2",
  "runtimeAssets": [
    {
      "macos": {
        "bytes": 167248,
        "height": 360,
        "path": "macos/Sources/PunchGrowMenuBar/Resources/Creatures/PG-001.png",
        "sha256": "b28a12a0c10f99a9233dcd5c7bfd07a8a43c84cdc73dbfe577ebb1c72c9d2d9f",
        "width": 360
      },
      "master": {
        "sha256": "1af39c2c4e9e4f720f727538e6613d6aea694ba4adb44237eac9a2b2ff63cfe4"
      },
      "mobile": {
        "bytes": 167248,
        "height": 360,
        "path": "assets/creatures/mobile/PG-001.png",
        "sha256": "b28a12a0c10f99a9233dcd5c7bfd07a8a43c84cdc73dbfe577ebb1c72c9d2d9f",
        "width": 360
      },
      "pgId": "PG-001"
    },
    {
      "macos": {
        "bytes": 154465,
        "height": 360,
        "path": "macos/Sources/PunchGrowMenuBar/Resources/Creatures/PG-002.png",
        "sha256": "5050e7a6e9fe31d288517d126192c80fa65d9156d7a94cd23526e56c0751b2f9",
        "width": 360
      },
      "master": {
        "sha256": "e4e440484fa950c7f94cd543e46e0db78160f446d85907c3afa0ad65b40a657a"
      },
      "mobile": {
        "bytes": 154465,
        "height": 360,
        "path": "assets/creatures/mobile/PG-002.png",
        "sha256": "5050e7a6e9fe31d288517d126192c80fa65d9156d7a94cd23526e56c0751b2f9",
        "width": 360
      },
      "pgId": "PG-002"
    },
    {
      "macos": {
        "bytes": 152390,
        "height": 360,
        "path": "macos/Sources/PunchGrowMenuBar/Resources/Creatures/PG-003.png",
        "sha256": "cf441b387a7c49e9813f365dc00320a0e0719ce95ef8283be8ea91b668ad4ed1",
        "width": 360
      },
      "master": {
        "sha256": "1ac4904aa70749a96115fcd15fc40b62e868142004e3e5614de76b31ba44580c"
      },
      "mobile": {
        "bytes": 152390,
        "height": 360,
        "path": "assets/creatures/mobile/PG-003.png",
        "sha256": "cf441b387a7c49e9813f365dc00320a0e0719ce95ef8283be8ea91b668ad4ed1",
        "width": 360
      },
      "pgId": "PG-003"
    },
    {
      "macos": {
        "bytes": 171888,
        "height": 360,
        "path": "macos/Sources/PunchGrowMenuBar/Resources/Creatures/PG-004.png",
        "sha256": "6350a7e32e8261d70f7ae352162698c7ff566fbe3a1b916ee75fed9cb628b0a4",
        "width": 360
      },
      "master": {
        "sha256": "7a27083f32e672ed496d0b0d4c4b413fabf2b72cb09632e05133aee82cd0e50c"
      },
      "mobile": {
        "bytes": 171888,
        "height": 360,
        "path": "assets/creatures/mobile/PG-004.png",
        "sha256": "6350a7e32e8261d70f7ae352162698c7ff566fbe3a1b916ee75fed9cb628b0a4",
        "width": 360
      },
      "pgId": "PG-004"
    },
    {
      "macos": {
        "bytes": 160798,
        "height": 360,
        "path": "macos/Sources/PunchGrowMenuBar/Resources/Creatures/PG-005.png",
        "sha256": "54559116e0ca6ba464aa0e06183086ccb9e0e5686fb39b2651223b91d5b63e50",
        "width": 360
      },
      "master": {
        "sha256": "28b598e8454d942cbcd3834c5e610897a5ddc9c01fc5bcc90513f988aa4f9707"
      },
      "mobile": {
        "bytes": 160798,
        "height": 360,
        "path": "assets/creatures/mobile/PG-005.png",
        "sha256": "54559116e0ca6ba464aa0e06183086ccb9e0e5686fb39b2651223b91d5b63e50",
        "width": 360
      },
      "pgId": "PG-005"
    },
    {
      "macos": {
        "bytes": 158466,
        "height": 360,
        "path": "macos/Sources/PunchGrowMenuBar/Resources/Creatures/PG-006.png",
        "sha256": "c0b24aedc04fb16cbaa65bf940b81dcc3e7db6cd7943c7347db54b087345736f",
        "width": 360
      },
      "master": {
        "sha256": "5f868d650de0f44e7028ef28ede515e06af8305c5c5bff6c0f74b5649db45382"
      },
      "mobile": {
        "bytes": 158466,
        "height": 360,
        "path": "assets/creatures/mobile/PG-006.png",
        "sha256": "c0b24aedc04fb16cbaa65bf940b81dcc3e7db6cd7943c7347db54b087345736f",
        "width": 360
      },
      "pgId": "PG-006"
    },
    {
      "macos": {
        "bytes": 155535,
        "height": 360,
        "path": "macos/Sources/PunchGrowMenuBar/Resources/Creatures/PG-007.png",
        "sha256": "f14f417c99cb4d27aca4c4293e19b5d36db6b2b32e4cf1f8c4293d19aad75e54",
        "width": 360
      },
      "master": {
        "sha256": "180cc13ea3c7f90530abc5320d99dad0167893d33d7abbabf470149d59a29fcb"
      },
      "mobile": {
        "bytes": 155535,
        "height": 360,
        "path": "assets/creatures/mobile/PG-007.png",
        "sha256": "f14f417c99cb4d27aca4c4293e19b5d36db6b2b32e4cf1f8c4293d19aad75e54",
        "width": 360
      },
      "pgId": "PG-007"
    },
    {
      "macos": {
        "bytes": 137364,
        "height": 360,
        "path": "macos/Sources/PunchGrowMenuBar/Resources/Creatures/PG-008.png",
        "sha256": "143c6638d6f0d6ff814c6fc1c696684843916f097637eb1ae4dad228a895b930",
        "width": 360
      },
      "master": {
        "sha256": "14dbb192869188a28eb60008fe969ddc13b5dc5b30a095d6f4a1d07219058c30"
      },
      "mobile": {
        "bytes": 137364,
        "height": 360,
        "path": "assets/creatures/mobile/PG-008.png",
        "sha256": "143c6638d6f0d6ff814c6fc1c696684843916f097637eb1ae4dad228a895b930",
        "width": 360
      },
      "pgId": "PG-008"
    },
    {
      "macos": {
        "bytes": 161291,
        "height": 360,
        "path": "macos/Sources/PunchGrowMenuBar/Resources/Creatures/PG-009.png",
        "sha256": "f7271e44d42551cce43021f1a57bad96d4ed68901feeea9ae52a029b2917e4b2",
        "width": 360
      },
      "master": {
        "sha256": "aa0e5bd7425d2ddbb627f17ab766e685a5fb76bb58ef3186356aa0737c2b58c6"